{ "type": "object", "properties": { "userConsentCapability": { "type": "string" }, "infoEndpointStandard": { "type": "string" }, "infoEndpoint": { "type": "string" }, "hardwareRevision": { "type": "string" }, "manufacturerLabel": { "type": "string" }, "manufacturerDescription": { "type": "string" }, "deviceName": { "type": "string" }, "deviceCode": { "type": "string" }, "brandName": { "type": "string" } }, "$id": "https://github.com/energywebfoundation/elia-energyblocks-vcs/tree/master/ontology/v1/Device", "$schema": "https://json-schema.org/draft/2020-12/schema", "title": "Device" }
