[
  {
    "brandName": "https://saref.etsi.org/saref4ener/brandName",
    "deviceCode": "https://saref.etsi.org/saref4ener/deviceCode",
    "deviceName": "https://saref.etsi.org/saref4ener/deviceName",
    "hardwareRevision": "https://saref.etsi.org/saref4ener/hardwareRevision",
    "infoEndpoint": "https://github.com/energywebfoundation/elia-energyblocks-vcs/tree/master/ontology/v1/Device/infoEndpoint",
    "infoEndpointStandard": "https://github.com/energywebfoundation/elia-energyblocks-vcs/tree/master/ontology/v1/Device/infoEndpointStandard",
    "manufacturerDescription": "https://saref.etsi.org/saref4ener/manufacturerDescription",
    "manufacturerLabel": "https://saref.etsi.org/saref4ener/manufacturerLabel",
    "userConsentCapability": "https://github.com/energywebfoundation/elia-energyblocks-vcs/tree/master/ontology/v1/Device/userConsentCapability"
  }
]
